[
  {
    "id": "INT001",
    "title": "Frontend Developer Intern",
    "company": "TechCorp India",
    "sector": "technology",
    "location": "Bangalore",
    "is_remote": true,
    "duration": "6 months",
    "stipend": "₹15,000/month",
    "description": "Work on modern web applications using React, JavaScript, and CSS. Learn about user interface design and responsive web development.",
    "requirements": ["computer", "communication"],
    "preferred_education": ["12th", "diploma", "undergraduate"],
    "application_deadline": "2024-12-31",
    "start_date": "2025-01-15",
    "contact_email": "careers@techcorp.in",
    "company_size": "medium",
    "benefits": ["Certificate", "Mentorship", "Project Experience"],
    "skills_offered": ["React", "JavaScript", "HTML/CSS", "UI/UX Design"],
    "certification": true,
    "full_time_potential": true,
    "language_requirements": ["English"],
    "accessibility": {
      "rural_friendly": true,
      "low_bandwidth_work": false,
      "flexible_hours": true
    }
  },
  {
    "id": "INT002",
    "title": "Digital Marketing Assistant",
    "company": "Growth Solutions",
    "sector": "retail",
    "location": "Mumbai",
    "is_remote": false,
    "duration": "4 months",
    "stipend": "₹12,000/month",
    "description": "Learn social media marketing, content creation, and digital advertising strategies. Support marketing campaigns and analyze performance metrics.",
    "requirements": ["communication", "computer"],
    "preferred_education": ["12th", "undergraduate"],
    "application_deadline": "2024-11-30",
    "start_date": "2024-12-15",
    "contact_email": "hr@growthsolutions.in",
    "company_size": "small",
    "benefits": ["Travel Allowance", "Training", "Portfolio Building"],
    "skills_offered": ["Social Media Marketing", "Content Writing", "Google Analytics", "Canva"],
    "certification": false,
    "full_time_potential": false,
    "language_requirements": ["English", "Hindi"],
    "accessibility": {
      "rural_friendly": false,
      "low_bandwidth_work": true,
      "flexible_hours": false
    }
  },
  {
    "id": "INT003",
    "title": "Data Entry Specialist",
    "company": "InfoSys Ltd",
    "sector": "technology",
    "location": "Remote",
    "is_remote": true,
    "duration": "3 months",
    "stipend": "₹10,000/month",
    "description": "Handle data processing, database management, and administrative tasks. Perfect for developing attention to detail and computer skills.",
    "requirements": ["computer", "accounting"],
    "preferred_education": ["10th", "12th", "diploma"],
    "application_deadline": "2025-01-15",
    "start_date": "2025-02-01",
    "contact_email": "jobs@infosys.in",
    "company_size": "large",
    "benefits": ["Flexible Hours", "Skills Training"],
    "skills_offered": ["Excel", "Database Management", "Data Analysis"],
    "certification": true,
    "full_time_potential": false,
    "language_requirements": ["English"],
    "accessibility": {
      "rural_friendly": true,
      "low_bandwidth_work": true,
      "flexible_hours": true
    }
  },
  {
    "id": "INT004",
    "title": "Teaching Assistant",
    "company": "Bright Minds Academy",
    "sector": "education",
    "location": "Delhi",
    "is_remote": false,
    "duration": "6 months",
    "stipend": "₹8,000/month",
    "description": "Assist teachers in classroom activities, help students with assignments, and support educational programs.",
    "requirements": ["teaching", "communication"],
    "preferred_education": ["12th", "undergraduate"],
    "application_deadline": "2024-12-15",
    "start_date": "2025-01-01",
    "contact_email": "hr@brightminds.edu.in",
    "company_size": "small",
    "benefits": ["Teaching Experience", "Professional Development", "Letter of Recommendation"],
    "skills_offered": ["Classroom Management", "Curriculum Planning", "Student Assessment"],
    "certification": true,
    "full_time_potential": true,
    "language_requirements": ["Hindi", "English"],
    "accessibility": {
      "rural_friendly": true,
      "low_bandwidth_work": true,
      "flexible_hours": false
    }
  },
  {
    "id": "INT005",
    "title": "Healthcare Support Intern",
    "company": "MedCare Hospitals",
    "sector": "healthcare",
    "location": "Chennai",
    "is_remote": false,
    "duration": "4 months",
    "stipend": "₹11,000/month",
    "description": "Support healthcare professionals in patient care, maintain medical records, and assist in hospital operations.",
    "requirements": ["healthcare", "communication"],
    "preferred_education": ["12th", "diploma"],
    "application_deadline": "2024-11-25",
    "start_date": "2024-12-01",
    "contact_email": "careers@medcare.in",
    "company_size": "large",
    "benefits": ["Medical Training", "Patient Interaction", "Healthcare Exposure"],
    "skills_offered": ["Patient Care", "Medical Records", "Healthcare Ethics"],
    "certification": true,
    "full_time_potential": true,
    "language_requirements": ["English", "Tamil"],
    "accessibility": {
      "rural_friendly": false,
      "low_bandwidth_work": false,
      "flexible_hours": false
    }
  },
  {
    "id": "INT006",
    "title": "Agricultural Research Assistant",
    "company": "Green Future Farms",
    "sector": "agriculture",
    "location": "Pune",
    "is_remote": false,
    "duration": "5 months",
    "stipend": "₹9,000/month",
    "description": "Support agricultural research projects, collect field data, and learn about sustainable farming practices.",
    "requirements": ["agriculture", "computer"],
    "preferred_education": ["12th", "diploma", "undergraduate"],
    "application_deadline": "2024-12-10",
    "start_date": "2025-01-05",
    "contact_email": "research@greenfuture.in",
    "company_size": "medium",
    "benefits": ["Field Experience", "Research Skills", "Sustainability Training"],
    "skills_offered": ["Data Collection", "Research Methods", "Sustainable Farming"],
    "certification": false,
    "full_time_potential": false,
    "language_requirements": ["English", "Marathi"],
    "accessibility": {
      "rural_friendly": true,
      "low_bandwidth_work": true,
      "flexible_hours": true
    }
  },
  {
    "id": "INT007",
    "title": "Finance Assistant",
    "company": "MoneyWise Advisors",
    "sector": "finance",
    "location": "Hyderabad",
    "is_remote": true,
    "duration": "4 months",
    "stipend": "₹13,000/month",
    "description": "Learn about financial planning, assist with client communications, and support financial analysis tasks.",
    "requirements": ["accounting", "communication"],
    "preferred_education": ["12th", "undergraduate"],
    "application_deadline": "2024-12-20",
    "start_date": "2025-01-10",
    "contact_email": "intern@moneywise.in",
    "company_size": "small",
    "benefits": ["Financial Training", "Client Interaction", "Industry Exposure"],
    "skills_offered": ["Financial Analysis", "Excel", "Client Communication"],
    "certification": true,
    "full_time_potential": true,
    "language_requirements": ["English", "Telugu"],
    "accessibility": {
      "rural_friendly": true,
      "low_bandwidth_work": true,
      "flexible_hours": true
    }
  },
  {
    "id": "INT008",
    "title": "Graphic Design Intern",
    "company": "Creative Studio",
    "sector": "retail",
    "location": "Remote",
    "is_remote": true,
    "duration": "3 months",
    "stipend": "₹12,000/month",
    "description": "Create visual content for social media, websites, and marketing materials. Learn design software and creative processes.",
    "requirements": ["design", "computer"],
    "preferred_education": ["12th", "diploma", "undergraduate"],
    "application_deadline": "2025-01-05",
    "start_date": "2025-02-01",
    "contact_email": "design@creativestudio.in",
    "company_size": "small",
    "benefits": ["Portfolio Building", "Software Training", "Creative Mentorship"],
    "skills_offered": ["Adobe Photoshop", "Illustrator", "Canva", "Brand Design"],
    "certification": false,
    "full_time_potential": false,
    "language_requirements": ["English"],
    "accessibility": {
      "rural_friendly": true,
      "low_bandwidth_work": false,
      "flexible_hours": true
    }
  }
]